{
  "$schema": "http://json-schema.org/draft-07/schema#",
  "definitions": {
    "xyzArray": {
      "type": "array",
      "description": "Array of 3 numbers, [x, y, z]",
      "items": { "type": "number" },
      "minItems": 3,
      "maxItems": 3
    }
  },
  "type": "object",
  "required": ["$otSharedSchema", "nozzleOffset", "pathTo3D"],
  "additionalProperties": false,
  "properties": {
    "$otSharedSchema": {
      "type": "string",
      "description": "The path to a valid Opentrons shared schema relative to the shared-data directory, without its extension. For instance, #/pipette/schemas/2/pipetteGeometrySchema.json is a reference to this schema."
    },
    "nozzleOffset": { "$ref": "#/definitions/xyzArray" },
    "pathTo3D": {
      "description": "path to the gltf file representing the 3D pipette model",
      "type": "string",
      "pattern": "^pipette/definitions/[2]/geometry/([a-z]*_[a-z]*)+/p[0-9]{2,4}/[a-z]*[.]gltf"
    },
    "nozzleMap": {
      "type": "object",
      "description": "Unordered object of well objects with position and dimensional information",
      "additionalProperties": false,
      "patternProperties": {
        "[A-Z]+[0-9]+": { "$ref": "#/definitions/xyzArray" }
      }
    }
  }
}
