{
  "$otSharedSchema": "#/pipette/schemas/2/pipetteGeometrySchema.json",
  "nozzleOffset": [0.0, 31.5, 19.4],
  "pathTo3D": "pipette/definitions/2/geometry/eight_channel/p20/placeholder.gltf",
  "nozzleMap": {
    "A1": [0.0, 31.5, 19.4],
    "B1": [0.0, 40.5, 19.4],
    "C1": [0.0, 49.5, 19.4],
    "D1": [0.0, 58.5, 19.4],
    "E1": [0.0, 67.5, 19.4],
    "F1": [0.0, 76.5, 19.4],
    "G1": [0.0, 85.5, 19.4],
    "H1": [0.0, 94.5, 19.4]
  }
}
